{"state_schema":"ferrodoc-document-state/1","source_pdf_sha256":"98432b90e7fea364e2d10302ea229d22e8d15dd6014fb1d0a0ff249883a491ff","ir_schema":{"major":1,"minor":0},"evidence_delta_ids":["delta_a7231c4020619c1550ee2b10478f4d792c436635b413161bd89831ad43a75904"],"reconciliation_policy_id":"6898e4f9c146378e51e10650a59ecb2e93dcbccdf5e40369f6ba0131204bbf6f","coverage":[],"materialized_ir_checkpoint":null,"parent_state_ids":[]}